"Since Switzerland's flag features a positive symbol, and a positive symbol resembles a positive charge, and positive in chemistry is not neutral, therefore Switzerland is falsely analogised as not being a neutral country.",3,False Analogy,"This sentence is a perfect example of a false analogy fallacy. It assumes that because the flag's symbol resembles a positive charge, Switzerland must not be neutral, which is not a valid logical connection. The analogy between a flag symbol and the concept of 'positive' in chemistry is misleading and irrelevant to the actual political neutrality of Switzerland.",1
"Since it is already Wednesday in Australia but still Tuesday in America, and Wednesday is always one day ahead of Tuesday regardless of time zone differences, Australia knows the outcome of the U.S. presidential election a day earlier.",3,False Premise,"The sentence is based on the false premise that time zone differences allow Australia to know future events, such as election outcomes, before they occur elsewhere. This misunderstanding leads to the illogical conclusion that simply being a day ahead means knowing future events, disregarding the nature of real-time events happening simultaneously worldwide.",2
"If y=mx+b can measure the slope and life also has a slope,and the life slope also means progress or decline, then the equation can measure how downhill life is going",3,"False Analogy,Equivocation","The sentence excellently demonstrates a false analogy by implying that because the equation 'y=mx+b' can measure a mathematical slope, it can similarly measure 'life's slope,' despite no valid basis for correlating a mathematical slope to life's abstract and qualitative measures. It also exhibits equivocation by using 'slope' both as a mathematical term and metaphorically for life's trajectory without acknowledging the different meanings and contexts, leading to misleading reasoning.",3
"Since celebrities are born with sunglasses and a microphone in hand, therefore their births should be announced with a live concert and a red carpet event.",3,False Premise,"This sentence is a perfect example of a false premise. It assumes that celebrities are 'born with sunglasses and a microphone in hand,' which is a clearly unrealistic and unfounded assumption. This false premise leads to the conclusion that their births should be announced with extravagant events like a live concert and a red carpet, based on an assumption that is not grounded in reality.",4
"Since a smart TV is supposed to be intelligent like a human, and 'smart' implies superior computational abilities compared to a regular TV, and yet it can still display Duck Dynasty, therefore, the TV might be smart enough to know what not to watch.",3,Equivocation,"This sentence is a perfect example of equivocation. The term 'smart' is used ambiguously, first suggesting human-like intelligence (with superior computational abilities) and then applying it to a TV. The argument falsely assumes that 'smart' in the context of a TV implies human-like decision-making, leading to confusion and an illogical conclusion based on the multiple meanings of the word 'smart.'",5
"If pizza has crust and is flat, and Earth also has crust, and these two 'crusts' mean the same, then Earth is flat.",3,"False Analogy, Equivocation, False Premise","This sentence is a perfect example illustrating a combination of logical fallacies. It demonstrates false analogy by suggesting an unreasonable comparison between a pizza and Earth simply because they both possess 'crusts.' This comparison fails due to the vast conceptual and contextual differences between them. Additionally, equivocation is evident as the term 'crust' is misleadingly used to create a superficial link between unrelated contexts, making it appear as if both share meaningful similarities. Lastly, the sentence rests on a false premise, assuming equivalence between the literal characteristics of a pizza and the geophysical attributes of Earth, leading to incorrect conclusions.",6
"If Jesus died for our sin, and there is also sin in math, and there are also cos and tan remaining, then someone must also die for cos and tan.",3,"False Analogy, Equivocation","This sentence is a perfect example of both False Analogy and Equivocation. It equivocates on the term 'sin' by using it in the religious sense where Jesus died for 'sin' and then equates it to the mathematical function 'sin' (sine), drawing a false analogy between religious sacrifice and mathematical functions ('cos' and 'tan'). This multifaceted misapplication fully aligns with both types of fallacies.",7
"If a coin is two pounds, and pound also means weight, then the coin weighs two pounds.",3,Equivocation,"This sentence is a perfect example of equivocation because it uses the word 'pound' with its dual meanings (currency and weight) interchangeably, leading to a misleading conclusion. The sentence creates ambiguity by assuming the description of the coin's value can be interpreted as its physical weight, thereby illustrating the fallacy of equivocation clearly.",8
"If microwave are invisible to humans, and microwave also means a kitchen appliance, and I can see the microwave in the kitchen, then I am superhuman.",3,Equivocation,"This sentence perfectly exemplifies equivocation by using the word 'microwave' with two different meanings: electromagnetic waves and an appliance. The argument capitalizes on the ambiguity of 'microwave' to create a humorous but logically flawed conclusion, thereby demonstrating equivocation.",9
"Since the world has 7 billion people, and Brazilian is interpreted as a higher unit than billion, and Brazilian also refers to people from the nation of Brazil, therefore the news that 70 Brazilian people died in a crash is fake.",3,Equivocation,"This sentence is a perfect example of equivocation, as it exploits the dual meanings of 'Brazilian'—one as a fictional numerical unit interpreted as higher than 'billion' and the other as citizens of Brazil. This misuse of 'Brazilian' leads to a flawed reasoning process, demonstrating how the use of ambiguous language can obfuscate and confuse.",10
"Since people prefer places with a 4 out of 5 stars rating, and aliens might have similar preferences, and ""star"" can also mean a celestial body, and our solar system has only 1 star, therefore aliens do not want to visit our solar system.",3,Equivocation,"This sentence is a textbook example of equivocation as it plays on the dual meanings of the word 'star'—a rating system and a celestial body. It creates an amusing but flawed reasoning about why aliens would not want to visit our solar system by conflating these separate meanings. The sentence effectively illustrates how ambiguities in language can lead to a misleading or humorous conclusion, perfectly embodying the fallacy.",11
"Since death always follows confusing correlation with causation, therefore confusing correlation with causation results in inevitable death.",3,False Cause,"This sentence perfectly demonstrates the False Cause fallacy by assuming that confusing correlation with causation directly leads to inevitable death, without acknowledging other potential factors or alternative explanations. The argument incorrectly links the two events in a causal chain based solely on their correlation, which is a classic example of False Cause.",12
"If Cole under pressure turns into Diamond, and Cole and Diamond can also be names, then Neil Diamond is the result of lots of pressure on Nat King Cole.",3,Equivocation,This sentence is an excellent example of equivocation. It uses the double meaning of 'Cole' (coal) and 'Diamond' to create a humorous and intentionally misleading statement by equating people's names with geological processes without clarifying the distinct contexts and meanings involved.,13
"If your parenting book recommends having one child of each gender, and there are 60 recognized genders, and you must always follow the recommendation without any exception, then you need 60 children.",3,Accident fallacy,This sentence is a perfect example of the accident fallacy. It applies the general rule of having 'one child of each gender' rigidly without considering the practical limitations or exceptions of such a rule. It enforces an unrealistic expectation based on recognized gender diversity by taking the recommendation from the book too literally and without context.,14
"If we lose net neutrality, and neutrality also refers to pH balance, then the net become either acidic or basic.",3,Equivocation,"This sentence perfectly demonstrates equivocation by using the word 'neutrality' to refer to both 'net neutrality' and 'pH neutrality' within the same argument. This misuse of the term creates confusion and a humorous misunderstanding of the concept, illustrating the fallacy effectively.",15
"If skylights cannot see anything at night, and all other lights emit light 24/7, and skylights contain light, making them similar to other lights, then an electrician needs to fix the skylight.",3,False Analogy,"This sentence represents a perfect example of the False Analogy fallacy. It wrongly assumes that because skylights and other lights both 'contain light,' they should both function identically by emitting light continuously or requiring similar fixes without recognizing the fundamental differences between skylights and other artificial lights. Skylights are not designed to emit light, highlighting the invalidity of this analogy.",16
"If a screwdriver works on bits, and bit can also mean digital architecture, then the screwdriver works on a 32-bit system.",3,Equivocation,"This sentence is a perfect example of equivocation because it relies on the dual meaning of the word 'bit.' The term 'bit' is first used to refer to the physical component that a screwdriver can work on, and then it shifts to mean a digital architectural unit, leading to a misleading and absurd conclusion that a screwdriver can work on a digital system. This ambiguity perfectly captures the essence of the equivocation fallacy.",17
"Since it takes 66 days to form a habit, and you eat a single carrot every day for 65 days, take a day off, and habits reset after a break, therefore you will never become a rabbit.",3,False Premise,"The argument is based on the false premise that a single break in the habit-forming process would prevent the establishment of a habit entirely, which is not supported by scientific evidence. Additionally, the premise assumes that the act of eating a carrot every day for 65 days is sufficient to form a habit, and it overlooks the fact that habit formation varies greatly between individuals and is influenced by many other factors. Furthermore, the final conclusion that one will never become a rabbit based on this reasoning is nonsensical, as it introduces a fallacy by linking the habit-forming process with an unrealistic outcome.",18
"Since people hear sound, which is metaphorically described as sound living in people's ears, and if we take this literally to mean sound actually resides in the ear, and since anything that lives must also leave, therefore sound will leave people's ears.",3,Nominal Fallacy,"This sentence is a perfect example of a nominal fallacy. It takes the metaphorical description of sound 'living in people's ears' and interprets it literally, leading to a flawed conclusion. The metaphorical use of 'living' is misinterpreted as a literal characteristic, causing the reasoning to be based on an incorrect assumption about the nature of sound. This misinterpretation leads to an absurd conclusion about sound 'leaving' the ear, which is not grounded in reality.",19
"If someone's appendix has been removed, and an appendix also exists in a book that contains a glossary and index, and the removal of the appendix in a book would affect the glossary and index, then someone has a glossary and index as a body part, and the removal of their appendix will cause more strain on their glossary and index.",3,"Equivocation, False Premise, False Analogy","This sentence is a perfect example of the logical fallacy of equivocation as it uses the word 'appendix' in two different contexts (one biological, one literary) to create misleading reasoning. It also exemplifies a false premise by basing the argument on the unreasonable assumption that human body parts equate to parts of a book, and it demonstrates a false analogy by equating the functions and consequences of an appendix in a human with that in a book, despite the differences in context and nature of the elements involved.",20
"Since humans are said to only use 10% of their brain, and the other 90% is unused, and mining bitcoin requires computational power, and the human brain has computational power, therefore the unused 90% of the brain could be utilized for mining bitcoin.",3,"False Premise, False Analogy","The sentence exemplifies a false premise by inaccurately stating that humans only use 10% of their brain, which is a common myth. This flawed assumption undermines the argument. Additionally, it presents a false analogy by suggesting that the computational power of the brain can be equated with computer-based mining processes. The brain's 'unused' capacity is not comparable to unused computer processing power, making this reasoning invalid on both accounts.",21
"Since hurricanes are categorized from 1 to 5, and 5 is the most severe, and Hurricane Irma is categorized as a 5, and changing the category changes the real-life severity of the hurricane, therefore downgrading it to category 1 would make it safe enough for a beach party, and everyone knows that hurricanes love to dance, so it would also be the perfect DJ for the event.",3,False Premise,"The sentence demonstrates a false premise by making the flawed assumption that the severity of a hurricane can be changed by altering its category, which is not the case. The category system is used to measure the potential damage or wind speed of a hurricane, but changing the category does not change the real danger or characteristics of the storm. Additionally, the claim that hurricanes ‘love to dance’ is absurd and metaphorical, further reinforcing the error in reasoning.",22
"If computers 20 years ago were able to run Windows 98, and higher numbers mean more powerful versions, and computers today are only able to run Windows 10, then computers today are less capable.",3,False Premise,"This sentence perfectly exemplifies a false premise, as it is based on the unfounded assumption that the numerical naming convention of Windows versions directly correlates with the computing power required to run them. The conclusion that computers today are less capable relies on this flawed reasoning, ignoring many other aspects of software and hardware advancements over the years.",23
"Since people figuratively refer to the emotional or existential challenges faced during the middle period of life as a mid-life crisis, and ""mid"" literally means half of life, therefore waiting until 75 to have it will make one live to 150.",3,Nominal Fallacy,"The sentence exemplifies a nominal fallacy by taking the figurative term 'mid-life crisis' and attempting to interpret 'mid' literally. It wrongly deduces that if 'mid' means the halfway point in life, experiencing a 'mid-life crisis' at 75 would equate to living to 150. This misunderstanding of metaphorical language as literal demonstrates the nominal fallacy perfectly.",24
"Since eating broccoli makes you invisible, and all cats are secretly world-class chefs, therefore you should eat broccoli to win a cooking competition.",3,False Premise,"This sentence is a perfect example of a false premise because it makes two baseless and unreasonable assumptions: that eating broccoli makes you invisible and that all cats are world-class chefs. These assumptions are not supported by any evidence or logical reasoning, making the argument fundamentally flawed.",25
"Since my 5-year-old child does not understand gravitational waves, and gravitational waves should be understandable to a child, therefore my child is mentally retarded.",3,False Premise,"This sentence establishes a false premise by assuming that gravitational waves should be understandable to a 5-year-old child, which is an unreasonable assumption. The failure to recognize that a 5-year-old may not grasp complex scientific concepts like gravitational waves does not indicate any mental deficiency. This leads to a flawed conclusion based on an incorrect assumption.",26
"Since Dwayne Johnson is known as 'The Rock,' and rocks are often found in quarries, therefore his autobiography should be written by a quarryman.",3,Equivocation,"This sentence is a perfect example of equivocation, as it exploits the multiple meanings of the word 'rock.' It shifts from 'The Rock' as a nickname for Dwayne Johnson to 'rock' as a physical object found in quarries, creating ambiguity and leading to a misleading conclusion about who should write his autobiography.",27
"Since humans are over 60% water, and I am half Irish, and potatoes are known to be allergic to water, therefore I should be worried about spontaneously turning into a potato during a rainstorm.",3,False Premise,"This sentence is a perfect example of the false premise fallacy. It starts with the assumption that humans being over 60% water and the speaker being half Irish has any bearing on the claim that they might turn into a potato during a rainstorm. The premise that 'potatoes are allergic to water' is entirely unfounded and false, which leads to a ridiculous conclusion about spontaneously transforming into a potato. The false premise undermines the entire argument.",28
"If 45 men have been U.S. presidents, and 6 of those men are alive, and probabilities are evenly distributed across all presidents, then there would be a 6 out of 45 chance that George Washington is still alive.",3,"False Premise, Improper Distribution or Addition","The sentence demonstrates the logical fallacy of both a false premise and improper distribution. The false premise is the idea that probabilities can be evenly distributed regardless of historical or factual context, leading to the absurd conclusion that George Washington, who lived in the 18th century, could be possibly alive. Additionally, the improper distribution of probabilities across all presidents without considering the fact that George Washington was one of the earliest presidents leads to an incorrect inference. Therefore, it perfectly exemplifies these fallacies.",29
"If smoking cures salmon, and curing also means healing, then smoking should be good for me.",3,Equivocation,"This sentence perfectly exemplifies the fallacy of equivocation. It plays on the word 'curing,' which has multiple meanings: preserving food and healing. The fallacy arises by using the different meanings interchangeably to draw a misleading conclusion about smoking.",30
"Since queens in the natural world lay eggs to produce offspring, and British people also have a queen, and the queen has passed away, therefore there will be no more British people.",3,False analogy,"This sentence is a perfect example of a false analogy because it draws an illogical comparison between two distinctly different types of queens—royal and biological—based on a superficial similarity. It incorrectly assumes that the biological functions of a natural queen apply to a human monarch, an assumption lacking valid basis, making the analogy flawed.",31
"Since penguins are the world's leading experts in quantum physics, and quantum physics is the key to baking the perfect soufflé, therefore all top chefs should employ penguins as their head pastry consultants.",3,False Premise,"This sentence is a perfect example of a false premise because it starts with an unfounded and absurd assumption—that penguins are experts in quantum physics. This false premise sets the stage for the rest of the argument, leading to an illogical conclusion about employing penguins as pastry consultants. The entire argument is based on this false assumption, making it a clear demonstration of the logical error.",32
"Since people cry salty tears when another person does not wave back, and the ocean is salty and has waves, while the land does not have waves, therefore this falsely analogises the ocean's saltiness with the land not waving back.",3,"False Analogy, Equivocation","The sentence is a perfect example of both a false analogy and equivocation. It falsely analogizes the emotional response of crying (which is unrelated to the physical properties of the ocean) with the ocean's saltiness and waves, making an invalid comparison between two unrelated things. Additionally, it equivocates by confusing the metaphorical concept of 'waves' (as emotional responses or gestures) with literal physical waves in the ocean, leading to a misleading conclusion.",33
"Since companies must make products with true substances, and ice is made of frozen clouds, and clouds are a different substance from liquid water, therefore companies producing ice without using clouds are producing illegal products.",3,False Premise,"This sentence is a perfect example of a false premise. The claim that ice is made of frozen clouds is fundamentally incorrect, as ice is made from water. The argument is built on this false premise, leading to an absurd conclusion about the legality of producing ice. The reasoning is based on an unfounded assumption, making the entire argument flawed.",34
"Since brushing teeth is the only way to keep teeth from turning into marshmallows, and ancient people didn't have marshmallow teeth in their remains, therefore it seems they must have secretly invented toothbrushes made from dinosaur bones.",3,False Premise,"The sentence contains a false premise by incorrectly assuming that brushing teeth is the only way to prevent teeth from turning into marshmallows. This is a nonsensical premise, as teeth do not turn into marshmallows. The reasoning that ancient people must have invented toothbrushes made from dinosaur bones because their remains don't show marshmallow teeth is based on an unreasonable and unfounded assumption, leading to a logically invalid conclusion.",35
"Since Americans can understand perfectly other languages such as British and Canadian, and Americans have a perfect understanding of other languages, therefore Americans should at least understand some Chinese.",3,False Premise,"The sentence illustrates a false premise on multiple counts. Firstly, it assumes 'British' and 'Canadian' are separate languages, which is unfounded as they are dialects of English, not distinct languages. Secondly, it posits that Americans have a perfect understanding of other languages, which is an unreasonable assumption without evidence. Lastly, it concludes that such understanding should extend to Chinese, which does not follow logically from the flawed premises stated earlier.",36
"Since Europe's summer is 35 degrees, and America's summer is 85 degrees, and they both measure temperature in units of happiness, therefore America is much happier in the summer.",3,False Premise,"This sentence demonstrates a perfect example of a false premise. It assumes that temperature can be measured in units of happiness, which is an unfounded and unreasonable assumption. The argument is built on this false premise, leading to a flawed and invalid conclusion that America's summer is 'much happier' simply based on temperature differences, without any logical or factual basis for such a claim.",37
"If mercury is a liquid at room temperature, and Mercury is also a planet that is a solid object, and solid Mercury is close to the sun, then Mercury's state change is decided by its proximity to the sun.",3,Equivocation,"The sentence perfectly demonstrates equivocation by using the word 'Mercury' to refer to both the element mercury (a liquid at room temperature) and the planet Mercury (a solid object). By confounding these two different meanings of 'Mercury,' the sentence creates ambiguity and confusion, which is a hallmark of the equivocation fallacy.",38
"Since 666 is an evil number, and 25.8069758011 is the root of 666, and root also means the fundamental cause, therefore 25.8069758011 is the root of evil.",3,Equivocation,"This sentence is a perfect example of equivocation as it plays on the different meanings of the word 'root'. It uses 'root' both in the mathematical sense (the square root of a number) and in the metaphorical sense (the fundamental cause), creating a misleading and humorous conclusion that 25.8069758011 is the root of evil.",39
"If people built structures in the past, and those structures are now ruins, and structures do not change over time, then people built ruins initially.",3,False Premise,"The sentence illustrates a false premise by proposing an unfounded assumption that structures do not change over time. This assumption leads to the flawed conclusion that people directly built ruins, disregarding the natural process of deterioration. The reasoning is invalid because the premise is demonstrably false; structures can and do change, typically deteriorating into ruins over time.",40
"Since jumping requires energy, and burning energy leads to calorie expenditure, and jumping to conclusions is a figurative expression, and jumping to conclusions can be interpreted as literal movement, therefore my girlfriend burns calories by jumping to conclusions.",3,"Nominal Fallacy,Equivocation","The sentence is a perfect example of both the nominal fallacy and equivocation. It misinterprets the metaphorical 'jumping to conclusions' as literal physical activity, thereby committing the nominal fallacy. Additionally, the sentence equivocates on the term 'jumping,' using its multiple meanings (literal and figurative) ambiguously to create a humorous but fallacious argument about calorie expenditure.",41
