"If I saw a GIF of a guy getting hit by a car, and I clicked 'save' before the car hit him, and 'save' literally means to protect someone, then I must have stopped the accident from happening.",3,"Equivocation,False Premise","This sentence is a perfect example of equivocation because it plays on the multiple meanings of the word 'save', misleadingly shifting between its digital context (saving a file) and its physical context (protecting someone). It also demonstrates a false premise by suggesting that saving a digital file can alter real-world events, a notion that is inherently unfounded and absurd.",253
"If donating a kidney means giving away a ""kid""ney, and kids grow into adults, then an ""adultney"" should grow back in its place.",3,"Equivocation,False Analogy","The sentence presents a perfect example of equivocation by playing on the homophonic similarity between 'kid' (as in a young goat or child) and 'kidney,' implying a nonsensical literal interpretation of the word. It also perfectly demonstrates a false analogy by suggesting that because 'kid' can grow into 'adult' linguistically, a literal biological organ could follow the same growth pattern absurdly, even though the premises are intentionally humorous and flawed. Both fallacies are clearly and humorously demonstrated here.",254
"If worms are short and wiggly, and snakes are long and wiggly, and animals often grow larger as they mature, then worms must eventually grow into snakes.",3,False Analogy,"This sentence is a perfect example of a false analogy as it draws an unwarranted comparison based on superficial similarities (both being wiggly) and makes an illogical conclusion that worms grow into snakes. The analogy fails to account for the vast biological differences between worms and snakes, making the reasoning flawed.",255
"Since the 1983 song 'The Safety Dance' was actually a secret government initiative to teach penguins how to waltz, therefore, it should have led to a significant increase in penguin participation in ballroom dance competitions.",3,False Premise,"This sentence presents a false premise by making an absurd and unfounded claim that the song 'The Safety Dance' was a secret government initiative to teach penguins how to waltz. This claim is completely unsubstantiated and leads to the illogical conclusion that penguins should have participated in ballroom dance competitions. The false premise underpins the entire argument, making it a perfect example of the fallacy.",256
"If time heals wounds, and time sounds like thyme, then thyme must heal wounds.",3,"Equivocation,False Analogy","This sentence perfectly demonstrates both equivocation and false analogy. It uses the word 'time' in two different senses: the passage of time and the sound-alike 'thyme,' leading to an ambiguous interpretation (equivocation). Additionally, the sentence creates a false analogy by incorrectly inferring that thyme, a herb, must have healing properties simply because its name sounds similar to time, which is reputed to heal wounds metaphorically. This is a classic example of using linguistic coincidence to create a faulty logical argument.",257
"Since inanimate objects at rest stay at rest until acted on by an external force, therefore, I, being an object at rest in bed, cannot be expected to get out of bed by myself.",3,False Analogy,"The sentence perfectly exemplifies a false analogy by comparing a person's behavior to the physical law governing inanimate objects. This comparison is flawed because it assumes that the characteristics of inanimate objects at rest are applicable to a conscious human, ignoring the distinct differences in agency and autonomy.",258
"If I put on a straightjacket, and ""straight"" means heterosexual, and a straightjacket should literally make people straight, and I still find men attractive, and I am a man, then the straightjacket must be broken.",3,"Equivocation, False Premise","This sentence is a perfect example of equivocation, as it plays on the dual meaning of the word ""straight"" – both as in 'straightjacket' (a restraint device) and 'straight' meaning heterosexual, leading to an absurd conclusion. The argument is based on a false premise, assuming that the purpose of a straightjacket is to change sexual orientation, which is not true in any context. Both forms of fallacy are clearly and directly demonstrated.",259
"If nuclear winter from 100 atomic bombs would cause global temperatures to fall by 1°C, and global warming needs temperature to fall, and nuclear winter has no other consequences, then we should just use nukes every time the temperature rises by 1°C.",3,False Premise,"The sentence relies on a patently false premise that 'nuclear winter has no other consequences,' which leads to an absurd and impractical conclusion. The false premise significantly undermines the logic of the argument, making this a textbook example of the fallacy.",260
"If antimatter annihilates matter on contact with great destructive power, and 'antipasta' sounds like the antimatter version of pasta, then eating pasta and antipasta at the same time should annihilate me.",3,"Equivocation,False Analogy","This sentence is a perfect example of both Equivocation and False Analogy. The fallacy of Equivocation occurs when 'antipasta' is assumed to be the 'antimatter' version of pasta based solely on a superficial similarity in sound, misleadingly applying the meaning of antimatter to the word antipasta. The False Analogy fallacy arises because the analogy between antimatter annihilating matter and the combination of pasta and antipasta has no valid basis, as the properties of antimatter do not translate to food items, making the reasoning flawed.",261
"Since I keep my secrets in a vault, and everyone knows the combination, and everyone has a key, therefore my secrets are securely locked away.",3,"Equivocation, False Premise","The sentence demonstrates equivocation through the ambiguous use of 'vault,' which implies physical security but is not accurately applied in the context of 'secrets'—something intangible. The false premise is that 'secrets' can be securely locked away like physical objects when, in reality, the idea of keeping secrets relies on factors beyond physical locks (like trust or discretion). This leads to an invalid conclusion about the security of the secrets.",262
"Since there is Extra Small (XS) and Extra Large (XL), and small and large are sizes, and medium is also a size, therefore, it is assumed there must be Extra Medium (XM).",3,False Analogy,"This sentence is a perfect illustration of a false analogy. It assumes that because the concepts of 'Extra Small' and 'Extra Large' exist in relation to 'Small' and 'Large', the same extension ('Extra') must logically apply to 'Medium'. However, this overlooks the fact that the category of sizes and their labels aren't constructed according to such rules or requirements, making the analogy between their names and dimensional significance flawed and unfounded.",263
"If Apple cares about environmental impact, and their OS uses a 'Trash Bin', while Microsoft uses a 'Recycling Bin', and recycling is more eco-friendly than trash, and digital bin names really make a difference, then Microsoft must be more eco-friendly.",3,False Premise,"This sentence is a perfect example of a false premise because it assumes that the name of a digital bin (such as 'Trash Bin' vs. 'Recycling Bin') has a significant impact on the actual environmental impact of the companies involved. The argument relies on an unfounded assumption that the naming convention of digital files correlates directly with eco-friendliness, which is not a valid basis for comparison. Therefore, the premise is false, leading to an invalid conclusion.",264
"Since making a fist causes my hand to biologically transform into a fist, therefore my hand must have become the president of the United States.",3,False Premise,"The sentence presents a false premise by incorrectly assuming that making a fist leads to the hand biologically transforming in a way that could somehow result in it becoming the president of the United States. The argument is based on a nonsensical assumption that doesn't hold up logically, thus demonstrating a clear example of a false premise.",265
"Since a well-known phrase has been selectively quoted to imply that people literally grasp at straws, and since this misquotation is based on the false premise that straws have actually been banned, therefore one might erroneously conclude that people are wandering around with nothing to hold onto, desperately searching for something to clutch in their hands.",3,"Contextomy,False Premise","This sentence is a perfect example of both contextomy and false premise. It showcases contextomy by selectively quoting the phrase 'grasping at straws' in a way that distorts its original meaning, suggesting that people literally grasp at straws. The false premise lies in the incorrect assumption that straws have been banned, which forms the basis for the erroneous conclusion that people are desperately searching for something to hold onto. Both elements are clearly demonstrated in the sentence.",266
"Since cats can speak fluent French, therefore they must be the best tour guides in Paris.",3,False Premise,"The sentence is based on the false assumption that cats can speak fluent French, which is not true. As a result, the entire argument that they must be the best tour guides is flawed. The reasoning relies on a false premise, perfectly exemplifying the fallacy.",267
"If a Cold War is cold by its name, and global warming is making the world hot, then another Cold War should help cool things down.",3,Nominal Fallacy,"This sentence is a perfect example of a Nominal Fallacy. It takes the metaphorical use of the term 'Cold War' literally by suggesting that another Cold War could physically cool down global warming. This misinterpretation aligns with the definition provided, as it mistakes metaphorical significance for literal meaning, leading to an absurd conclusion.",268
"Since helium makes voices sound high-pitched in the mouth and farts produce sound, therefore it is falsely analogised that helium farts should sound funny.",2,False Analogy,"This sentence presents a false analogy by suggesting that because helium affects the pitch of one's voice and farts make sound, the two must be similar in the way they produce humorous effects. The analogy overlooks the significant differences between the effects of helium on vocal cords and the nature of fart sounds, which do not share a valid basis for comparison in terms of humor or pitch alteration. Thus, the analogy is mostly flawed but not entirely nonsensical.",269
"Since a nuclear bomb explodes with the light of 100 suns, and SPF 50 sunscreen protects me from the sun, therefore, wearing SPF 50 sunscreen will allow me to safely sunbathe during a nuclear explosion.",3,False Premise,"This sentence demonstrates a perfect example of a false premise fallacy. It assumes that SPF 50 sunscreen, which protects from the sun’s UV rays, would offer protection in the drastically different and much more intense conditions of a nuclear explosion. This premise is unfounded and false, as the properties of sunscreen do not apply to a nuclear explosion, making the reasoning invalid.",270
"If I installed all new CO detectors in my house, and CO is the abbreviation for Colorado, and I live in CO, then my CO detectors should be going off.",3,Equivocation,"The sentence perfectly demonstrates equivocation by using the abbreviation 'CO' to mean both carbon monoxide and Colorado, creating confusion and an illogical conclusion. The play on the abbreviation results in misleading reasoning about why the detectors should alarm, highlighting the ambiguity in meaning that is central to this fallacy.",271
"Since 'bite the dust' is interpreted as dying, therefore, it logically follows that consuming dust is a dangerous activity that could lead to one's demise.",3,"Contextomy, Nominal Fallacy","This sentence exemplifies both the Contextomy and Nominal Fallacy. The phrase 'bite the dust' is taken out of context and interpreted literally, leading to a misunderstanding of its figurative meaning (Contextomy). Additionally, it incorrectly assumes that the literal act of 'biting dust' directly equates to consuming dust in reality, which is a misapplication of the figurative expression (Nominal Fallacy). Thus, it perfectly demonstrates both fallacies.",272
"Since the pen is literally a weapon more powerful than a sword, therefore, libraries should be filled with the clamor of sword fights, as writing is supposed to be the quietest activity imaginable, creating a paradox where silent sword fights dominate libraries.",3,"Contextomy,False Premise","This sentence demonstrates a perfect example of both contextomy and false premise. It distorts the well-known metaphor 'the pen is mightier than the sword' by taking it literally, which exemplifies contextomy. Additionally, it constructs an absurd argument based on this misinterpretation, leading to a false premise that writing should produce literal sword fights in libraries, reinforcing flawed reasoning.",273
"Since sound travels as a sinusoidal wave, therefore it must be able to tie itself into a knot, and since knots are known to be the fastest way to travel through time, therefore sound should be able to time travel.",3,False Premise,"This sentence is a clear example of a false premise because it assumes that sound, being a sinusoidal wave, can tie itself into a knot without any scientific basis for such an assumption. The argument then builds on this flawed assumption by linking knots to time travel, which is also unsupported and illogical, leading to an unfounded conclusion about sound being able to time travel.",274
"If plants grow in fields, and magnetic fields have ""fields"" in their name, then magnets should grow in magnetic fields.",3,False Analogy,"This is a perfect example of false analogy. The sentence makes an invalid comparison between two occurrences based solely on the shared use of the word 'fields' without any logical basis. It presumes that because plants grow in fields, magnets should grow in magnetic fields, ignoring the entirely different context and meanings of 'field' in each case.",275
"If sitting in the bath makes my skin wrinkled, and old men have wrinkled skin, then staying in the bath for 60-74 years should make me biologically an old man.",3,False Analogy,"This sentence is a classic example of a false analogy because it incorrectly assumes that because old men have wrinkled skin from aging and sitting in the bath creates temporarily wrinkled skin, the extended duration of bathing could age a person biologically into an old man. This analogy fails because the wrinkling of skin in the bath is a different phenomenon than the aging process, and therefore, the conclusion drawn is flawed.",276
"Since 1 cat + 1 cat = 2 cats, and 1 idea + 1 idea = 1 bigger idea, therefore, ideas must be cats in disguise.",3,False Premise,"The sentence presents a false premise by assuming that the logical operations applied to cats (addition resulting in a simple sum) can be directly applied to ideas, without justification for this analogy. The premise that ideas can be added together like cats and lead to a 'bigger idea' is flawed, and this leads to the erroneous conclusion that ideas must be 'cats in disguise.' The argument is based on an unfounded and false assumption.",277
"Since it takes light 8 minutes to travel from the Sun to Earth, therefore, if I stare at the Sun for only a few minutes and my eyes don't hurt, it must mean that the Sun has decided to take a nap and is currently dreaming about being a disco ball, hence pausing its light show.",3,False Premise,"This sentence is a perfect example of a false premise fallacy. It assumes that the absence of immediate pain while staring at the Sun implies that the Sun is not emitting light at that moment, which is clearly an unfounded and unrealistic assumption. The premise about the Sun ‘taking a nap’ or ‘dreaming’ is not grounded in any factual basis and leads to a flawed conclusion.",278
"Since alcohol is a depressant and depressants are actually secret happiness boosters, therefore, when I'm drunk, I'm tapping into my inner joy, which means sober me must be living in a constant state of ecstatic bliss.",3,False Premise,"This sentence exemplifies the False Premise fallacy perfectly. It is built on the incorrect assumption that depressants function as 'secret happiness boosters,' which is factually inaccurate. Depressants slow down the central nervous system rather than inherently boosting happiness. The argument further compounds this faulty reasoning by making an illogical inference that sobriety equates to a state of 'ecstatic bliss,' which does not logically follow. The flawed premises drive the entire conclusion, making this a textbook case of the fallacy.",279
"If Apple introduced 'Thunderbolt' and 'Lightning', and thunder and lightning are followed by 'very, very frightening' in the song 'Bohemian Rhapsody', then Apple’s next technology should be called 'Very Very Frightening'.",3,"False Premise,False Analogy","This sentence is a perfect example of both a false premise and a false analogy. The false premise lies in the assumption that the naming of Apple's technologies is based on the song 'Bohemian Rhapsody,' which is a non-existent or unreasonable assumption. The false analogy is evident because the sentence assumes that because 'thunder' and 'lightning' are mentioned in a song in a specific order, Apple should follow this pattern when naming its technologies. The comparison between the song's lyrics and Apple's product names is illogical and irrelevant, as they are not connected in any meaningful way. This makes the sentence a clear demonstration of both fallacies.",280
"If 70% of shelter dogs are euthanized, and that literally means 70% of a dog's body, then you should be able to euthanize 70% of a single dog.",3,"False Premise,Equivocation","The sentence perfectly demonstrates equivocation by using '70%' ambiguously, misleadingly suggesting it refers to a portion of a single dog's body rather than indicating a proportion of the population of dogs. It also uses a false premise, assuming one can take a statistic about a group and apply it physically to an individual, a clear misunderstanding of statistical language.",281
"Since my country has a moon and Spain also has a moon, therefore, every country must have its own moon, which explains why the moon is always full during international meetings.",3,False Premise,"The sentence assumes a false premise by connecting two unrelated facts: that both the user's country and Spain have a moon, and that all countries must have their own moon. It further misattributes the full moon during international meetings to this false assumption, making the argument invalid and based on an unfounded premise.",282
"If I bought a ticket to Vancouver, BC, and BC usually also means 'Before Christ', then I must be traveling back in time.",3,Equivocation,"This sentence is a perfect example of equivocation. It plays on the double meaning of 'BC', which can refer to 'British Columbia' in a geographic sense and 'Before Christ' in a historical sense, creating confusion and leading to the absurd conclusion that the speaker is traveling back in time.",283
"If my sister got her period at 14, and I’m 28 and haven’t gotten mine yet, and I am male, and males should have periods, then I should see a doctor.",3,False Premise,"This sentence is built on a clearly inaccurate assumption that males should have periods, which is biologically incorrect. This unfounded premise leads to the flawed conclusion that a male who hasn't had a period should see a doctor. This perfectly illustrates a false premise, as the argument is founded on an assertion that is patently false.",284
"If every periodic table lists sodium’s chemical symbol as ""Na"", and ""Na"" usually means ""Not Applicable"", then sodium must not have a valid chemical symbol.",3,Equivocation,"This sentence is a perfect example of equivocation because it plays on the dual meanings of ""Na""—as the chemical symbol for sodium and as an abbreviation for ""Not Applicable."" By conflating these meanings, the argument misleadingly concludes that sodium cannot have a valid chemical symbol, demonstrating how equivocation creates confusion and leads to illogical conclusions.",285
"Since I'm going to a lake, and a lake has water, and water is wet, and ""wet"" means slippery, therefore I am in danger of sliding into an alternate dimension where fish rule the world.",3,"False Premise,Equivocation","This sentence contains a false premise, as it makes an unfounded assumption that being near water (which is 'wet') leads to sliding into an alternate dimension where fish rule. The idea of sliding into a different dimension is baseless and does not logically follow from the premises about water. Additionally, the word 'wet' is equivocated—it's being used to mean both its literal definition (water) and an unusual, non-standard meaning (slippery), creating confusion and making the reasoning flawed. The conclusion is absurd and stems from these false premises and misleading language use.",286
"Since people keep talking about the 'low key' and low keys are literally keys in the lower position of a keyboard, and I cannot find the low key on my keyboard, therefore, my keyboard must be broken.",3,"Nominal Fallacy, False Premise","This sentence demonstrates a Nominal Fallacy by interpreting the term 'low key' literally, assuming it refers to a physical key on the keyboard, when 'low key' is actually a figurative expression. The False Premise is shown in the flawed assumption that a 'low key' must exist as a physical key on the keyboard, and the argument concludes that the keyboard must be broken because it doesn't have such a key. This misinterpretation leads to an unreasonable conclusion.",287
"Since the nearest star is actually a giant disco ball that reflects wishes back to Earth, therefore, it only takes 2.18 years for a wish to be granted because the disco ball spins at twice the speed of light.",3,False Premise,"The sentence is based on a completely unfounded and fantastical premise—that the nearest star is a giant disco ball that reflects wishes. This false assumption leads to an invalid conclusion about how long it takes for wishes to be granted. Since the reasoning is entirely built on a non-existent and unreasonable assumption, it perfectly exemplifies the False Premise fallacy.",288
"If Google Maps has pins, and pins in real-life maps are physically planted, then pins in Google Maps must also be physically planted.",3,False Analogy,"This sentence is a perfect example of a false analogy. It draws an improper comparison between digital and physical maps based only on the similarity of 'pins,' despite the lack of practical or reasonable correspondence. The nature of pins in a digital environment is entirely different from those in the physical world, making the analogy invalid.",289
"Since we have discovered letters from A to Z, therefore, the alphabet must be a secret code from aliens, and if we rearrange it correctly, it will unlock the ability to communicate with squirrels.",3,False Premise,"The sentence relies on a clearly unfounded and unreasonable assumption that the alphabet is a secret code from aliens designed to communicate with squirrels. This premise is not based on any factual evidence and exemplifies an invalid basis for further conclusions, thus perfectly illustrating a false premise.",290
"Since people who compose experimental music are conducting experiments, therefore, should they be wearing lab coats to prevent any accidental key changes, or is it just a matter of keeping their notes in harmony?",3,Equivocation,"This sentence perfectly demonstrates equivocation. The term 'conducting experiments' is used with two different meanings: in the first part, it refers to scientific or laboratory experiments, which would involve wearing lab coats, while in the second part, it refers to musical experimentation. The ambiguity of the term 'experiment' misleads the reasoning by implying a connection between scientific procedure and musical composition, where none exists in the intended sense. This is a textbook example of equivocation.",291
"If there are an estimated 391,000 species of flowers on Earth, and flowers 'eat' sunlight, and sunlight comes from the Sun, and eating sunlight consumes the Sun, then the Sun will eventually be eaten up one day.",3,False Premise,"This sentence demonstrates a False Premise because it is based on an unreasonable assumption that flowers 'eating' sunlight will somehow consume the Sun. The logic fails because it misrepresents the nature of how plants use sunlight and incorrectly assumes that consuming sunlight could deplete the Sun itself, which is scientifically inaccurate.",292
"Since higher education literally means education that is conducted in higher places, and birds fly at high altitudes, therefore teaching classes on the backs of eagles should lead to higher education.",3,"False Premise, Nominal Fallacy","This sentence is a perfect example of both a false premise and a nominal fallacy. The false premise is that the literal meaning of 'higher education' involves being at high altitudes, while the nominal fallacy misinterprets 'higher education' based on the word 'higher.' The argument makes an illogical leap by conflating the literal meaning of 'higher' with the actual concept of higher education, leading to an absurd conclusion about teaching on eagles' backs.",293
