"Since lighter means a device that produces a small flame using gases, and lighter aslo means relatively low in weight, and lighter means in gases in the lighter, and the gases are light, and big one has more lighter than little one, therefore big lighter is ligher than small one.",3,Equivocation,"This sentence is a perfect example of the equivocation fallacy, as it exploits the multiple meanings of 'lighter'—both as a device and as a descriptor of weight. It deliberately mixes these meanings to create confusion and arrive at a nonsensical conclusion.",373
"Since Mercury means a planet, and mercury also means a chemical element, and mercury is on the periodic table, therefore all other planets should be on the periodic table.",3,"False Analogy, Equivocation","The sentence is a perfect example of equivocation because it misleadingly uses the word 'Mercury' to refer both to a planet and a chemical element, creating ambiguity. It then extends this confusion to make a false analogy by implying that because 'mercury' (the element) is on the periodic table, other planets should be as well. This clearly disregards the distinct and unrelated nature of planets as astronomical bodies and elements as chemical substances.",374
"If light years means weight, and light years are not heavy, and light objects can leap further, then a light-year must be farther than a leap year.",3,"Equivocation, False Premise","This sentence is a perfect example of equivocation, as it uses the term 'light year' to mean weight in one part and distance in another, causing confusion. The use of 'light' to refer to weight and 'light-year' to refer to distance leads to a misleading analogy between a light-year and a leap year, which is a false premise. The reasoning presented is illogical, as it relies on these misused terms to make an invalid conclusion about the nature of a 'light-year'.",375
"Since everything underwater is wet, and everything in contact with the air is dry, and my insides are wet, therefore my insides are under water.",3,False Premise,"The sentence demonstrates a clear false premise by assuming that being wet necessarily means being underwater, which is an unreasonable and unfounded assumption. The conclusion drawn from this premise—that because one's insides are wet, they must be underwater—follows from the faulty assumption, making it a strong example of this fallacy.",376
"If the states in the U.S. fit together perfectly with no gaps, and puzzle pieces also fit together perfectly, then the U.S. must be a giant puzzle.",3,False Analogy,The sentence exemplifies a false analogy by equating the U.S. to a puzzle merely because they share a characteristic—pieces fitting together. This overlooks the fundamental difference between the conceptual and functional nature of a puzzle and a political entity like the U.S.,377
"Since ""milestone"" refers to an important achievement, and ""mile"" is an imperial unit of distance, and Canada uses the metric system, and miles kilometers in metric system, therefore Canadians should call it a ""kilometerstone.""",3,False Premise,"The sentence is built on a false premise that the term ""milestone"" must be adjusted to fit the metric system simply because it contains the word ""mile."" However, ""milestone"" in this context is a figurative expression with an established meaning unrelated to the measurement system. The reasoning is flawed because it assumes that linguistic conventions must follow measurement standards, which is an unreasonable and incorrect assumption.",378
"Since a solid-state hard drive is literally in a solid state and solid turns into gas when heated, and since gas state hard drives exist in reality and clouds are made of gas, and cloud computing involves storing data in a non-physical form, therefore heating my solid-state hard drive until it becomes a gas should enable cloud computing.",3,"Nominal Fallacy, False Premise","This sentence is a perfect example of a Nominal Fallacy, where the term 'solid-state' is taken literally, ignoring its intended technical meaning related to electronics, not physical states of matter. Additionally, this exemplifies a False Premise by assuming solid-state drives can be transformed physically to enable cloud computing, which is a fundamentally flawed assumption. The reasoning conflates physical properties of matter with technological concepts, highlighting both fallacies expertly.",379
"Since upvotes increase visibility online and visibility is what we need to see through the fog, therefore, people should upvote to clear the weather.",3,"Equivocation,False Premise","This sentence demonstrates both equivocation and a false premise. The word 'visibility' is used in two different senses: one refers to online visibility (popularity or exposure), and the other refers to physical visibility (ability to see through fog). The argument assumes these two meanings are equivalent, which is an example of equivocation. Additionally, the premise that upvotes can clear the weather is based on a false assumption, as upvotes have no actual impact on weather conditions, making the reasoning flawed and demonstrating a false premise.",380
"Since dinosaur fossils can be used for oil, and dinosaurs can be cloned, and dinosaurs will immediately become fossils once buried, therefore we can clone dinosaurs to solve the energy crisis.",3,False Premise,"The argument is built on multiple false premises: that dinosaurs can currently be cloned, that they would 'immediately' become fossils and produce usable oil for energy, and that this process could feasibly solve the energy crisis. Each step relies on an unfounded assumption, illustrating the fallacy well.",381
"Since atoms make up everything, and make up also means make fake, and things that are fake cannot be trusted, therefore everything is fake",3,Equivocation,This sentence is a perfect example of equivocation. It misleadingly uses the phrase 'make up' with two different meanings: one as in 'comprising or constituting' atoms and the other as in 'faking or fabricating something'. This shifts the meaning of 'make up' to create confusion and ultimately leads to an unreasonable conclusion. The fallacy is effectively demonstrated.,382
"If a family of five moles is found in my lawn, and moles are also a measurement in chemistry, and molarity is defined as moles per liter, then it is possible to calculate the molarity.",3,Equivocation,"This sentence is a perfect example of equivocation, as it plays on the dual meaning of the word 'moles' — referring both to the animal and to a unit of measurement in chemistry — to create confusion. The sentence intentionally conflates these meanings to suggest an absurd conclusion about calculating molarity from the presence of animals rather than chemical units.",383
"Since we cry for onions when cutting onions, and crying is only a response to onions being sad, and we continue to cut onions despite this reaction, therefore onions must be the world's smallest violinists playing a sad tune.",3,False Premise,"This sentence is a perfect example of a false premise because it assumes that crying while cutting onions is a response to onions being 'sad', which is an unfounded and unreasonable assumption. It then incorrectly builds an argument that onions are playing a sad tune, based on this false premise, leading to flawed reasoning and an illogical conclusion.",384
"Since the Zodiac Killer is understood to literally kill zodiac signs, and Cancer is both a zodiac sign and a disease, therefore, the Zodiac Killer should have literally killed Cancer.",3,"Nominal Fallacy, False Premise","This sentence is a perfect example of a Nominal Fallacy, as it takes the term 'Zodiac' and misinterprets it literally, ignoring its metaphorical or symbolic meaning. It also relies on a False Premise by assuming that the Zodiac Killer's actions should follow a literal interpretation of 'zodiac signs,' disregarding the fact that the term 'zodiac' in the killer's name refers to the astrological signs, not diseases. The reasoning behind the statement is entirely flawed and nonsensical, as it conflates unrelated concepts based on a misinterpretation of the term 'Cancer.'",385
"Since red blood cells are literally made of tiny red balloons, and white blood cells are actually marshmallows, and mixing balloons and marshmallows creates a fluffy party, therefore human blood should be a festive decoration.",3,False Premise,"The sentence is a perfect example of a false premise because it is based on the fundamentally incorrect assumption that red and white blood cells are made of 'tiny red balloons' and 'marshmallows.' These are not true characteristics of blood cells, and the conclusion that human blood should be a festive decoration is absurdly derived from these false premises. The argument is entirely based on unreasonable assumptions, making it a textbook case of a false premise fallacy.",386
"Since barrier is always manually set up, and barriers are set up for orders, and the sound barrier is a kind of barrier, and the sound barrier is often intentionally broken, therefore there is no point in setting up the sound barrier to begin with",3,False Premise,"The sentence establishes its argument on the unfounded premise that just because barriers, in general, are manually set up and intentionally broken, this applies to the sound barrier without examining the distinct scientific and contextual differences. This results in flawed reasoning, as the concept of the physical 'sound barrier' does not relate to a literal barrier that humans manually erect and dismantle. The argument relies on an unreasonable assumption about the nature of barriers and how the term 'sound barrier' is used, making it a textbook example of the 'False Premise' fallacy.",387
"Since the word ""decimate"" originally meant to kill one in every ten, and ""mate"" sounds like a friend, therefore decimate literally means to make friends by reducing your social circle.",3,Equivocation,"This sentence perfectly demonstrates the fallacy of equivocation by using the word 'mate' in two different contexts: one as part of the word 'decimate,' referring to the killing of a specific number, and another meaning 'friend' in a literal sense. The ambiguity of the word 'mate' creates a misleading conclusion that decimate means to make friends, which is an example of equivocation.",388
"Since the James Webb Space Telescope can see things as they were millions of years in the past without relying on anything else, and since dinosaurs were known to be avid photographers, therefore we should be able to point it at Earth to retrieve selfies taken by dinosaurs.",3,False Premise,"The sentence assumes the premise that dinosaurs were avid photographers, which is a completely false and unfounded claim. This forms the basis of the argument and leads to the flawed conclusion that the James Webb Space Telescope could retrieve selfies taken by dinosaurs. The false premise invalidates the entire argument.",389
"Since Pavlov conditioned dogs to salivate when they heard a bell, and conditioning creates automatic responses, therefore it is amusing to speculate that Pavlov might have humorously developed a habit of feeding a dog every time he heard a bell.",2,False Cause,"The sentence demonstrates a False Cause fallacy by assuming that the conditioning Pavlov conducted with dogs, which leads to automatic responses, is directly related to him developing a habit of feeding a dog upon hearing a bell. This falsely assumes that the cause (conditioning of dogs) would naturally lead to a humorous consequence for Pavlov, without accounting for other factors or logical reasoning.",390
"Since colorblind people cannot see certain colors, and 'see' can also mean to date someone, and dating is a form of relationship, therefore colorblind people cannot date an orange.",3,"Equivocation, False Premise","This sentence is a perfect example of both equivocation and false premise. The word 'see' is used ambiguously, switching between its literal meaning related to vision and its metaphorical meaning related to dating, which creates confusion and leads to the fallacious conclusion. Additionally, the premise that colorblind people 'cannot see' certain colors is used inappropriately to make a conclusion about their ability to 'date' an orange, which is based on a false premise that oranges can be 'dated'.",391
"Since iceberg lettuce literally means the lettuce growing on the iceberg, and global warming melts icebergs, and melting reduces supply, therefore the world's supply of iceberg lettuce must be in danger due to global warming.",3,Nominal Fallacy,"The sentence perfectly exemplifies the nominal fallacy by taking the metaphorical name 'iceberg lettuce' literally and assuming it grows on icebergs. The reasoning then follows this literal interpretation to draw an erroneous conclusion about the impact of global warming on the supply of iceberg lettuce, which in reality is unrelated to actual icebergs. This demonstrates a misunderstanding based on the literal meaning of a term intended to be metaphorical.",392
"If Kobe is retired, and Kobe also refers to high-quality beef, and ""retired"" means less active in the public, and there will be less Kobe in the market, and less product means higher price, then the retirement of Kobe should affect the price of beef.",3,Equivocation,"This sentence uses the word 'Kobe' equivocally to refer to both a retired basketball player and a high-quality type of beef, which leads to a confusing and misleading argument about market pricing. This perfectly illustrates equivocation, as the multiple meanings of 'Kobe' are conflated.",393
"Since 'relative' means association with something, and 'relative' means a person connected by blood or marriage, and time is relative, and time can be represented by an alarm clock, and many people sleep with alarm clock, and it is illegal to sleep with relative, therefore many people have broken the law.",3,Equivocation,"This sentence is a perfect example of equivocation. It uses the word 'relative' with different meanings in different contexts (association with something, a family member, and time) to create a misleading argument. The confusion between these meanings leads to the false conclusion that many people have broken the law.",394
"Since 'oxy' in oxymoron relates to oxygen, and 'moron' means someone unintelligent, and the opposite of a moron is a genius, and if a word exists there is an antonym, therefore.",3,"False Premise, Equivocation","This sentence perfectly demonstrates both false premise and equivocation. It begins with a false premise by assuming the parts of 'oxymoron' relate meaningfully to its components ('oxy' as oxygen and 'moron' as unintelligent), which is unfounded as 'oxymoron' is a figure of speech not derived from these meanings. Additionally, it demonstrates equivocation by using 'moron' with both its perceived literal meaning and as part of the word 'oxymoron' in a misleading way, suggesting an antonym exists where it does not, due to a misinterpretation of language structure.",395
"Sinice 'ajar' means slightly open, and 'ajar' also looks like ’a jar’, therefore opening a door enough times should make it a jar.",3,"False Analogy, Equivocation","The sentence demonstrates a perfect example of a false analogy and equivocation. It creates a false analogy by assuming that because 'ajar' and 'a jar' share a resemblance in sound, one must be the same as the other in terms of meaning. The use of the word 'ajar' is also an equivocation, as it shifts from its meaning of 'slightly open' to the unrelated concept of a 'jar,' misleading the argument and creating confusion.",396
"If water surrounds all fish, and predators surround their prey, then water should prey on all the fish.",3,False Analogy,"This sentence is an excellent example of a false analogy. It draws a parallel between water surrounding fish and predators surrounding prey, suggesting that water behaves like a predator in preying on fish. However, the comparison lacks a valid basis as the nature of water merely surrounding fish does not imply predation, unlike the role of predators.",397
"Since gravity is stronger in Alaska than at the equator, therefore, penguins in Alaska must be heavier than elephants at the equator, and since zoos charge entry fees based on the weight of their animals, visiting a zoo in Alaska should be more expensive than a safari in Africa.",3,False Premise,"The sentence contains a false premise, assuming that the weight of animals is directly affected by gravity in a way that would make penguins in Alaska heavier than elephants at the equator. This premise is flawed because the effect of gravity on weight is not significant enough to create such a vast difference in weight between these animals. The flawed assumption leads to an illogical conclusion about zoo entry fees.",398
"Since 'work' means effective, and work also means job, and the saying 'If it's stupid but it works, it isn't stupid' implies that if a chair is effective, it must be a genius, therefore my coworkers are actually chairs, creating a paradox.",3,Contextomy,"The sentence distorts the original meaning of the saying and plays on the multiple meanings of the word 'work' and 'chair.' By selectively altering the context and making absurd connections (such as equating coworkers with chairs), it misrepresents the original intent of the saying and creates a nonsensical conclusion. This is a clear case of contextomy, as it involves selectively quoting or interpreting phrases in a way that distorts their meaning.",399
"Since snails have shells, and shells are the houses of snails, and snails without shells are slugs, and a housing crisis causes people to lose their houses, therefore slugs are snails affected by the housing crisis.",3,False Analogy,"This sentence is a perfect example of a false analogy because it draws an unwarranted parallel between the relationship of snails and their shells to the housing crisis and people losing their houses. The comparison assumes that since snails' shells are like homes, slugs (which lack shells) must be analogous to people losing their homes during a housing crisis. This reasoning is flawed because the conditions of snails and humans are too different to justify such an analogy.",400
"Since there is a saying, ""If it's stupid but it works, it isn't stupid,"" and the saying applies to actions, and my pet rock is still stupid, and it can solve complex calculus problems, therefore the saying must be wrong.",3,False Premise,"The argument is based on an unfounded assumption that a pet rock can solve complex calculus problems, which is unrealistic and not a reasonable premise. This leads to a flawed conclusion, making it a strong example of the False Premise fallacy.",401
"Since muting a TV or YouTube video makes the sound disappear, and sound is a type of invisible cat, and invisible cats that disappear must be hiding in a secret dimension, therefore the sound must be frolicking with other invisible cats in a parallel universe.",3,False Premise,"The sentence establishes a series of unfounded and unreasonable assumptions that sound is a type of 'invisible cat' and that such entities hide in a secret dimension. These premises are entirely baseless and fantastical, perfectly illustrating the fallacy of false premises leading to a nonsensical conclusion.",402
"If quitting smoking is called ""quitting cold turkey,"" and turkey is a type of food, and food can be quit easily, then quitting smoking should be easy.",3,"Equivocation, False Analogy","This sentence perfectly demonstrates both equivocation and false analogy. Equivocation is used as the word 'turkey' is misleadingly interpreted in different contexts—once as part of an idiomatic expression and once as a type of food—leading to an incorrect inference. Additionally, there's a false analogy as it draws an unreasonable parallel between quitting smoking and quitting eating food based on the shared term 'turkey'.",403
"If Pluto is a dwarf planet, and dwarves exist, and dwarf planet residents are dwarves, then we should try to contact the dwarves living there.",3,"Equivocation,False Premise","The sentence perfectly demonstrates equivocation through the use of the term 'dwarf,' applying it misleadingly both to mythological creatures and to an astronomical classification, creating ambiguity. Meanwhile, the false premise lies in assuming that 'dwarf planet residents' actually exist and are similar to mythological dwarves, an unfounded assertion without scientific basis.",404
"Since drowning happens when there are too many water, and drinking water consumes water, and people can drink unstoppingly, therefore people can just drink the water to avoid drowning.",3,False Premise,"The sentence is based on a false premise that people can drink water indefinitely to avoid drowning. This premise is unfounded and unreasonable, as human physiological limits would prevent such a scenario. The conclusion drawn from this false premise is inherently flawed, making it a perfect example of this fallacy.",405
"Since I have ducks, and there's a product called 'duck tape,' therefore, just as cow leather is derived from cows, my ducks should logically be producing tape.",3,"Equivocation, False Analogy","The sentence exhibits both equivocation and false analogy. The word 'duck' is used ambiguously, initially referring to the animal and then to a product name, creating confusion. The analogy between cow leather and ducks producing tape is flawed because it assumes that because 'duck' and 'duck tape' are related in name, they must be connected in function, which lacks a valid basis. This creates a false analogy based on an illogical comparison.",406
"Since a physical coin can be flipped, and bitcoin is the also a physical coin, therefore bitcoin can be flipped.",3,False premise,"The sentence is based on an incorrect assumption that bitcoin, a digital currency, is a 'physical coin,' which is a false premise. The reasoning follows that if bitcoin is a physical coin, it should be capable of being flipped like physical coins. This illustrates the false premise fallacy perfectly, as the initial premise about bitcoin being a physical coin is unfounded and leads to a flawed conclusion.",407
"If WiFi signals are physically carried by the air, and fans move air, then placing a fan behind my router should boost the WiFi signal.",3,False premise,"The sentence presents a false premise by assuming that the physical movement of air will directly affect WiFi signals, which are electromagnetic waves, not air molecules. The reasoning is flawed because the premise incorrectly equates the movement of air with the potential to enhance WiFi signals, which are not influenced by air movement in this manner.",408
"Since states mean political regions, and strates mean forms of matter, and there are only three forms of matter, therefore American only has 3 states.",3,Equivocation,The sentence demonstrates equivocation by using the word 'states' in two different senses: political regions and forms of matter ('strates'). This creates a misleading and confusing interpretation by drawing an unrelated conclusion based on the ambiguity of 'states.',409
"Since a wood saw is used to saw wood, and a chainsaw is similar with wood saw, therefore people can use chainsaw to saw chains",3,False Analogy,"This sentence perfectly exemplifies a false analogy by mistaking the tool's purpose based on superficial similarities. It assumes that because both a wood saw and a chainsaw are used to cut materials, they can interchangeably cut both wood and chains, ignoring the specific design differences and intended uses of each tool.",410
"Since 4 out of 5 dentists recommend a certain toothpaste, and since dentists classify toothpaste strictly as either recommended or non-recommended with no middle ground, therefore if I reject the recommended option, I am forced to choose the toothpaste that only 1 out of 5 dentists recommend.",3,False dilemma,"This sentence presents a false dilemma by suggesting that there are only two possible toothpaste choices: one recommended by 4 out of 5 dentists and one recommended by just 1 out of 5, ignoring the possibility of other toothpaste options or alternative recommendations outside the binary choice.",411
"Since 8 hours of sleep is the recommended amount, and I only have one spare hour, and multiplying intensity to do tasks could reduce time, and sleep is also a task, therefore sleeping 8 times as hard for one hour should be equivalent to 8 hours of sleep.",3,"False Analogy,Improper Distribution or Addition","The sentence is a perfect illustration of both a false analogy and improper distribution. It attempts to draw an analogy between sleep and tasks that can be completed more intensively in a shorter time span. It falsely assumes that sleep, like a task, can be concentrated or intensified and distributed over a shorter period. This ignores the complex and non-linear nature of sleep, where the benefits cannot be simply multiplied or adjusted by intensity. Thus, it demonstrates both logical fallacies effectively.",412
"Since hurricanes announce their landfall days ahead, and surprise attacks are more effective when they are unexpected, and hurricanes want to attack people, therefore hurricanes should not announce their landfall in advance.",3,False premise,"The argument is based on the false premise that hurricanes have intentions similar to humans, such as wanting to attack people. In reality, hurricanes lack agency and intentions as they are natural phenomena. This flawed assumption forms the basis of the argument, making it a perfect example of a false premise fallacy.",413
