"Since Europe uses the metric system, and grams are used for measuring weight, and grams can also be telegrams, therefore all European messages must weigh a ton.",3,"Equivocation, False Analogy","This sentence is a perfect example of both equivocation and false analogy. It equivocates by using the word 'grams' in two different contexts: one referring to a unit of weight and the other to telegrams. This creates confusion between the two meanings of 'grams.' Additionally, the sentence draws a false analogy by assuming that because 'grams' can refer to both weight and telegrams, all European messages must weigh a ton, which ignores the lack of logical connection between the concepts of measuring weight and sending messages.",127
"Since water is actually a solid and solid things can't be consumed, therefore drinking water means I'm just pretending to drink, and I should be able to juggle it like a clown.",3,False Premise,"The sentence is based on the false premise that water is a solid, which is not true at typical temperatures and pressures. This false assumption leads to the illogical conclusion that drinking water is merely pretending, and the argument about juggling it like a clown follows from this incorrect premise.",128
"Since people generate all new cells every seven years, they become physically new, and being physically new means they must have a new favorite color, therefore everyone should repaint their houses every seven years to match their new favorite color.",3,False Premise,"This sentence presents a false premise by assuming that the process of generating new cells every seven years leads to someone becoming 'physically new' and that this somehow necessitates a change in their favorite color. The reasoning is based on an unfounded assumption about how biological processes are linked to personal preferences, which is flawed and unreasonable.",129
"Since evolution is a process of adapting to the environment, and clothing is part of the environment, and people wear clothes that fit perfectly, therefore, people must have evolved to fit clothing.",3,Wrong Direction,"This sentence is a perfect example of the 'Wrong Direction' fallacy. It incorrectly assumes that people have evolved to fit clothing, reversing the actual cause-and-effect relationship, where clothing is designed to fit people. The reasoning attributes the effect (people fitting clothes) as the cause of evolution, rather than understanding that clothes (an artificial and modifiable aspect) have been made to suit human bodies.",130
"Since blood tests are labeled with letters, and school tests are also graded with letters, and an 'A' in school means better, and I got B+ blood, therefore, I should aim for an A in my next blood test.",3,False Analogy,"The sentence exemplifies a false analogy by drawing a parallel between school grading systems and blood type labeling solely based on the use of letters, despite these contexts having no valid correlation in terms of meaning or progression. Grade letters signify achievement in education, whereas blood types are part of a genetic biological system, making the comparison entirely inappropriate and misleading.",131
"Since the deep sea is full of pressure, and pressure in cooking can be relieved by using a pressure cooker, and pressure cookers make things tender, therefore we can tenderly explore the deep sea by simply cooking under pressure.",3,Equivocation,This sentence is a perfect example of equivocation. The word 'pressure' is used in two different senses: one referring to the physical pressure found in the deep sea and the other referring to the cooking process in a pressure cooker. The logical jump from these two meanings creates confusion and leads to a fallacious conclusion that exploring the deep sea can be achieved through cooking under pressure.,132
"Since my German Shepherd is clearly a descendant of the famous German composer Beethoven, therefore it must be able to play the piano, and I should either learn to play the piano myself or teach my Shepherd to read sheet music so we can perform duets together.",3,False Premise,"The sentence presents a false premise by assuming that being a descendant of the composer Beethoven somehow entails the ability to play the piano, which is an unfounded and unreasonable assumption. This leads to flawed reasoning and invalid conclusions about what the dog is capable of, making it a perfect example of a false premise fallacy.",133
"Since yesterday was 2015, and today is 2016, therefore the transition from one day to the next coincides with the change of the year.",3,False Cause,"This is a textbook example of the False Cause fallacy. The statement incorrectly assumes that the change from one day to the next directly causes the change in the year. In reality, the transition from December 31 to January 1 is a convention of the calendar system rather than a causal relationship between daily transitions and yearly changes.",134
"Since a watched pot never boils, and never boils implies the temperature remains constant, therefore, if we stare at the ice caps, they should stop melting.",3,Contextomy,"The sentence distorts the original meaning of the proverb 'a watched pot never boils' by taking it literally and applying it to a completely unrelated phenomenon (the melting of ice caps). The proverb is a metaphor about perception of time, not a statement about physical processes. The argument misrepresents the original intent and applies it to an environmental issue, creating confusion and misleading conclusions.",135
"If Albert Einstein was so great, and great people should last forever, then he shouldn’t be dead.",3,False Premise,"This sentence is a perfect example of the False Premise fallacy because it relies on the unfounded assumption that 'great people should last forever.' This premise is clearly unreasonable and false, leading to a flawed conclusion that Einstein shouldn’t be dead.",136
"If one woman takes nine months to make a baby, and teamwork speeds up groupwork tasks, and baby production is also a groupwork task, then nine women should be able to make a baby in one month.",3,False Premise,"The sentence demonstrates a false premise by assuming that the concept of teamwork, which may speed up certain group tasks, can be applied to a biological process like pregnancy. The premise is flawed because pregnancy is not a task that can be sped up through additional labor or teamwork, making the conclusion invalid.",137
"Since soap is actually a sentient being that can choose to stay or leave, therefore, it must be plotting its escape every time I take a shower, just like my socks that vanish in the laundry.",3,False Premise,"This sentence is a perfect example of a false premise. It assumes that soap is a sentient being capable of making decisions, which is a completely unfounded and irrational assumption. This false assumption forms the basis of the argument, leading to the incorrect conclusion that soap 'plots its escape' in a manner similar to the disappearance of socks. The sentence rests on an invalid, non-existent premise.",138
"Since dogs go 'woof,' and wolves go 'owwwwwwwl,' and they are all animals, and owls go 'who,' therefore 'who' must be an animal.",3,False Analogy,"The sentence makes an analogy between the sounds made by dogs, wolves, and owls, attempting to conclude that since 'who' is a sound made by an owl, 'who' must therefore be an animal. This is a false analogy because the shared characteristic (the sound) does not logically imply that the sound itself is an animal. The reasoning ignores the significant differences between animals and the sounds they make, leading to an incorrect conclusion.",139
"If 700,000 people die in hospitals every year, and hospitals cause people's deaths, then closing hospitals should prevent those deaths.",3,False Premise,"The sentence presents an argument based on an unfounded assumption that hospitals are directly causing the deaths of these individuals, without considering alternative explanations such as people being in hospitals because they are already critically ill. This sets up a false premise that leads to an unreasonable conclusion that closing hospitals would prevent these deaths, perfectly showcasing the false premise fallacy.",140
"If Mercury is 77 million km from Earth, and ""mercury"" also refers to a heavy metal deadly to fish, then the planet Mercury must be deadly to fish.",3,Equivocation,This sentence perfectly demonstrates equivocation by using the word 'mercury' in two different contexts—one as the planet Mercury and the other as the element mercury—creating ambiguity and leading to a nonsensical conclusion about the planet's danger to fish.,141
"Since Buzz Lightyear is only a few inches tall, and a light-year is an astronomical unit, and space is very huge, therefore a light-year is too small to describe the universe.",3,Equivocation,"This sentence is a perfect example of equivocation, as it deliberately exploits the different meanings of 'light-year'—a character's name and an astronomical unit of distance. The argument misleadingly combines these meanings to create confusion and an inaccurate conclusion about the size of the universe.",142
"Since 'days' can mean daytime, and 'days' can also mean a full 24 hours, and I sleep at night, and humans would die after 10 days without sleep, therefore, my doctor should not be shocked when I told him I haven’t slept for 10 days.",3,Equivocation,"The sentence is a perfect example of equivocation, as it uses the word 'days' with two different meanings: daytime and a full 24-hour period. The speaker switches between these meanings to create confusion, implying that not sleeping during the day for 10 days is equivalent to not sleeping for 10 full 24-hour periods. This misleads the argument by exploiting the ambiguity of the word 'days.'",143
"Since drinking alcohol makes me feel great, therefore drinking water the next day must be the reason I feel terrible.",3,False Cause,"This sentence is a classic example of the false cause fallacy, where the speaker incorrectly attributes the negative effects experienced the day after drinking alcohol to the consumption of water. It disregards the most likely cause, which is the body's reaction to alcohol. The fallacy is perfectly demonstrated as it fails to account for other plausible explanations for feeling terrible, such as a hangover from alcohol consumption.",144
"Since the speed number on my car is higher when using KM/H rather than MPH, and America uses MPH, and a higher speed number always means faster regardless of unit, therefore being American makes my car slow.",3,False Premise,"The sentence establishes a false premise by incorrectly assuming that a higher numerical speed value inherently means a faster speed, without considering the difference in units between KM/H and MPH. This leads to an invalid conclusion that being in America makes the car slow. The reasoning is based on a flawed assumption and is a perfect example of the fallacy.",145
"If 4 out of 5 people suffer from diarrhea, and people can only either suffer or enjoy, then the fifth person must enjoy diarrhea.",3,False Dilemma,"This sentence perfectly exemplifies a false dilemma by presenting only two extreme possibilities: that people must either suffer or enjoy diarrhea, without acknowledging that the fifth person could have other reactions, such as being unaffected. It presents a binary opposition where more nuanced possibilities exist, capturing the essence of a false dilemma.",146
"Since carbon can turn into diamond under pressure, and a carbon footprint is made of carbon, therefore applying enough pressure should turn my carbon footprint into a diamond footprint.",3,False Analogy,"This sentence is a perfect example of false analogy. It compares the molecular transformation of carbon into diamond, a specific chemical process, with the metaphorical concept of a carbon footprint, implying that the same physical process can apply. This creates an invalid comparison by linking two unrelated concepts based solely on the incidental use of 'carbon.'",147
"Since Pringles says ""once you pop, the fun don’t stop,"" and the fun has literally never ended, therefore, opening a can of Pringles means I will never stop the fun.",3,Contextomy,"This sentence perfectly demonstrates contextomy by taking the Pringles slogan — which is clearly meant as playful marketing — and interpreting it literally to draw an absurd conclusion. The original intent of the slogan is distorted, leading to a misrepresentation of its meaning.",148
"Since my clock reads 8:03 right now, and it said 8:02 about a minute ago, and time travel means moving forward in time by accelerating time flow, and 8:02 advancing to 8:03 in one minute is accelerating time flow, therefore I am a time traveler.",3,False Premise,"The argument is based on a fundamentally flawed assumption—that the normal passage of time equates to time travel. This premise is demonstrably false, as time travel typically refers to movement through time at a rate different from the standard flow. The reasoning collapses because it relies on an incorrect definition, making this a perfect example of a false premise.",149
"Since ballerinas need to be taller, and eating spaghetti makes them grow taller, therefore hiring Italian chefs should solve the problem.",3,False Premise,"The sentence is based on the false premise that eating spaghetti directly causes growth in height, which is an unreasonable and unfounded assumption. It mistakenly links spaghetti consumption with height growth and suggests that hiring Italian chefs would solve the problem of ballerinas needing to be taller. This argument is fundamentally flawed due to the unsupported and unrealistic premise that eating a specific food can lead to the desired outcome.",150
"Since ""Einstein"" is now another name for genius people, and ""Einstein"" was also a name back when Einstein was born, therefore his parents must have known the future that their son would be a genius.",3,False Premise,"The sentence is a perfect example of a false premise because it assumes unreasonably that naming a child 'Einstein' implies foresight into the child's future intellect, confusing the actual historical fact with current cultural associations.",151
"If my download speed is 20 Mbps and my upload speed is 5 Mbps, and things fall down easier than they go up because of gravity, then gravity must be affecting my internet speed.",3,False Analogy,"This sentence is a perfect example of a false analogy. It compares the effect of gravity on physical objects (things falling easier than they go up) to internet speeds, which are unrelated. The analogy assumes that because both involve a form of 'directional influence' (falling vs. downloading/uploading), gravity must be affecting internet speed. This is a flawed comparison as the two concepts are fundamentally different in nature and cannot be equated in this way.",152
"Since 'period' means the periodic table of the elements, and 'period' also means menstruation, and menstruation is blood, and the periodic table contains various chemical substances, and blood is also a chemical substance, therefore blood should be on the periodic table.",3,"Equivocation,False Premise","This sentence is a textbook example of both equivocation and a false premise. The word 'period' is used ambiguously to mean two very different things (the periodic table and menstruation), which misleads the argument (Equivocation). Additionally, the premise that blood should be on the periodic table based on the fact that blood is a chemical substance is false because it incorrectly assumes that all substances in the periodic table are necessarily biological substances like blood (False Premise). The argument is logically flawed and misleading, making it a clear instance of both fallacies.",153
"Since my 250-million-year-old Himalayan pink salt expired in 2021, and it was only recently canned, therefore the salt must have been attending night classes in time travel mechanics to ensure it could graduate with honors in culinary history and surprise modern chefs with its diploma in ancient flavor engineering.",3,False Premise,"This sentence humorously constructs an argument based on an absurd and clearly false premise: the idea that an ancient salt could attend 'night classes in time travel mechanics.' The premise is entirely unreasonable, combining fictional and fantastical elements that are not logically related to the situation of expired salt. This makes it a perfect example of the false premise fallacy, as it presents an unfounded assumption that undermines the logic of the conclusion.",154
"Since the moon is made of cheese and cheese is delicious, therefore the moon is more useful than the sun, which is just a big ball of fire and doesn't taste good at all.",3,False Premise,"The sentence is a perfect example of the False Premise fallacy. It assumes that the moon is made of cheese, which is a completely unfounded and false premise. This assumption leads to the conclusion that the moon is more useful than the sun, based on a premise that is not true. The argument is built on an unrealistic and incorrect assumption about the moon, which invalidates the reasoning.",155
"Since guns don't kill people but people use guns to kill, therefore, if toasters don't toast toast but toast uses toasters, then toast toasts toast.",3,"False Analogy, False Premise","The sentence presents a perfect example of a False Analogy fallacy. It compares the relationship between guns and people to that of toasters and toast, but the analogy is flawed because the characteristics of guns and toasters are fundamentally different in relation to their functions. Guns are tools that require people to operate them with intent, while toasters are devices designed to operate automatically on an item (toast). The analogy breaks down because it assumes that just because one tool (a gun) requires human intervention to function, another tool (a toaster) must also be able to be described in the same manner. Additionally, the premise that 'guns don't kill people, but people use guns to kill' simplifies the issue of gun violence and is a false premise because it ignores the role of the gun as an instrument in the act of killing. The overall reasoning is invalid due to both the false analogy and the false premise.",156
"If we only use 10% of our brain at a time, and we share 98% of our DNA with chimps, and our bodies are 70% water, then our brain should be 6.86% swimming chimps.",3,Improper Distribution or Addition,"The sentence displays Improper Distribution or Addition by combining unrelated statistical percentages from different contexts as if they are directly additive or distributive. It fails to consider how these separate percentages interact, leading to an absurd conclusion about the brain being composed of 'swimming chimps.' This is a textbook example of improperly summing up individual effects without considering their actual relationships or interactions.",157
"Since 800,000 people drown each year and 800,000 have already drowned this year, therefore, I must be the only person who can breathe underwater like a mermaid.",3,False Premise,"This sentence demonstrates a false premise because it assumes that the number of people who drown each year has any direct correlation to the speaker's ability to breathe underwater, which is an unfounded and unreasonable assumption. The premise that only one person could be immune to drowning is not supported by any logical or factual basis.",158
"If people are concerned about global warming, and global warming means higher temperatures, and a Cold War is literally cold temperature, then starting another Cold War should help cool things down.",3,Nominal Fallacy,"The sentence perfectly exemplifies a nominal fallacy by confusing the metaphorical term 'Cold War' with its literal weather-associated meaning. It takes the figurative expression 'Cold War' to mean actual cold temperatures, leading to an absurd conclusion that is based on this misinterpretation.",159
"Since every time I eat a slice of pizza, I gain the ability to speak fluent dolphin for 20 minutes, and it takes me 10 minutes to finish a slice, therefore, by the time I finish my meal, I should have 10 extra minutes to negotiate a peace treaty between dolphins and seagulls and become the ambassador of the ocean.",3,False Premise,"The sentence is a perfect example of a false premise because it starts with an unfounded assumption: that eating pizza results in the ability to speak fluent dolphin, a claim with no logical or scientific basis. The entire argument relies on this false premise, leading to a conclusion (becoming an ambassador of the ocean) that is not supported by any real-world reasoning.",160
"Since I believe that my cat's purring controls the weather, and it rained when she purred yesterday, therefore my cat is the true ruler of the climate.",3,False Premise,"This sentence demonstrates a false premise because it is based on an unreasonable assumption that the cat's purring controls the weather. The conclusion is drawn from an unfounded and unsupported premise, leading to an invalid reasoning process. The connection between the cat's purring and the weather is not established with evidence, making it a clear example of a false premise.",161
"Since in the 1990s I could easily lift a 27"" TV, and now I can easily lift a 65"" TV, therefore, I must have developed superhuman strength over the years, making me the strongest person on the planet.",3,False Premise,"The argument is based on a false premise that lifting a larger TV implies the development of superhuman strength. The reasoning fails to account for other factors, such as advancements in TV technology making modern TVs lighter than older models. The assumption that the ability to lift a larger TV directly equates to superhuman strength is entirely unsupported, making this a clear example of a false premise fallacy.",162
"If I have been living in a nuclear family for most of my life, and ""nuclear"" in physics also causes radiation, then I should eventually suffer from radiation poisoning.",3,Equivocation,"This sentence perfectly exemplifies the equivocation fallacy by using the word 'nuclear' in two different contexts with distinct meanings: 'nuclear family' as a social unit and 'nuclear' in physics as related to radiation. This misleading use creates a false assumption that the characteristics of nuclear physics apply to a family structure, thus leading to confusion.",163
"Since Chromium has atomic number 24, and Chrome is also a Google browser, and the suffix ""-ium"" indicates a chemical element, then other browsers should have corresponding atomic numbers.",3,"False Analogy, False Analogy","The sentence is a clear example of a false analogy because it attempts to extend the characteristics of the word 'Chromium' to the product name 'Chrome' based on superficial similarities. The atomic number of chemical elements is irrelevantly compared to web browsers, illustrating an incorrect inference that such characteristics should be applied analogously to other browser names, which is a classic case of false analogy.",164
"Since closing my eyes results in temporary darkness and blindness is a permanent inability to see, therefore, closing my eyes is falsely analogised to causing blindness.",3,False Analogy,"The sentence presents a false analogy by comparing two events, closing eyes and blindness, based on their shared characteristic of vision impairment. However, it overlooks the fundamental difference between temporary darkness (closing eyes) and permanent blindness, creating a flawed analogy. This results in an inaccurate comparison and the assumption that they are similar in more ways than they actually are.",165
"If millions of Americans watch the Superbowl every year, and Superbowl can also mean Superb Owl, and an owl is a bird, and I am an avid bird watcher, then I should be able to find this owl.",3,Equivocation,"This sentence is a perfect example of equivocation. It deliberately plays on the dual meanings of 'Superbowl' and 'Superb Owl', leading to an absurd conclusion that one could find an actual owl to watch simply because of a linguistic play on words. The use of 'Superbowl' in a sporting sense vs. 'Superb Owl' in a literal sense creates ambiguity and confusion, demonstrating the fallacy effectively.",166
"If my IQ is 80, and my friend’s IQ is 83, and teamwork means combining intelligence, and IQ numbers can be added like regular numbers, then together we should have an IQ of 163.",3,"False Premise,False Analogy","This sentence demonstrates both a false premise and a false analogy. The false premise lies in the assumption that IQ numbers can be added like regular numbers, ignoring the fact that IQ is a standardized measure that doesn't function in a linear, additive manner. The false analogy occurs in the comparison between teamwork (which involves the collaborative efforts of individuals) and the idea of adding IQ numbers, which inaccurately equates intellectual collaboration with simple numerical addition.",167
"If seat belts are so safe, then making entire cars out of seat belts should make them the safest vehicles ever.",3,Fallacy of composition,This sentence perfectly demonstrates the fallacy of composition by assuming that what is true for a part (seat belts being safe) must also be true for the whole (a car made entirely of seat belts being the safest). It overlooks the complexities and requirements of vehicle safety that go beyond just incorporating seat belts.,168
